{
  "schemaVersion": "1.0.0",
  "packageVersion": "0.1.0",
  "status": "draft",
  "generatedAt": "2026-10-27T06:38:27.266698+00:00",
  "modelLockHash": "38b2f58b5f3f946959be0fc608e3174cef7048b7d77374fc80d5315e3cc468d0",
  "levels": [
    {
      "schemaVersion": "1.0.0",
      "id": "L1-01",
      "level": 1,
      "template": "coref-repeat",
      "tokens": [
        "奶娃",
        "起床",
        "，",
        "奶娃",
        "吃饭",
        "，",
        "奶娃",
        "，",
        "奶娃",
        "，",
        "奶娃",
        "笑",
        "了",
        "。"
      ],
      "focus": 11,
      "punct": [
        2,
        5,
        7,
        9,
        13
      ],
      "coref": [
        {
          "entity": "奶娃",
          "members": [
            0,
            3,
            6,
            8,
            10
          ],
          "refersFrom": []
        }
      ],
      "causal": [],
      "attention": {
        "lenses": {
          "panorama": [
            0.05475825632700167,
            0.1344916901397531,
            0.0,
            0.0399255662872029,
            0.13326018385630364,
            0.0,
            0.08147222830555854,
            0.0,
            0.11477061635933886,
            0.0,
            0.10827356519677474,
            0.0,
            0.33304789352806646,
            0.0
          ],
          "coref": [
            0.09121729352509912,
            0.12062017730581985,
            0.0,
            0.09134357886904376,
            0.0955210820872877,
            0.0,
            0.14053057013328613,
            0.0,
            0.12239971778214907,
            0.0,
            0.14837057275562246,
            0.0,
            0.1899970075416919,
            0.0
          ],
          "causal": [
            0.10126940388780808,
            0.10585610066837582,
            0.0,
            0.09781150694588064,
            0.28739085774218076,
            0.0,
            0.1184828942498943,
            0.0,
            0.1230763182800305,
            0.0,
            0.10939844181849813,
            0.0,
            0.05671447640733177,
            0.0
          ],
          "emotion": [
            0.1369857529014315,
            0.1058537016342709,
            0.0,
            0.11370932087364174,
            0.23895060255004671,
            0.0,
            0.12274410934133642,
            0.0,
            0.13138533330949484,
            0.0,
            0.1089084854482431,
            0.0,
            0.04146269394153479,
            0.0
          ],
          "position": [
            0.016030620942126268,
            0.014551556572098662,
            0.0,
            0.013565298475295357,
            0.015457159332882935,
            0.0,
            0.011112913112274999,
            0.0,
            0.03946232561468416,
            0.0,
            0.798106199194921,
            0.0,
            0.09171392675571666,
            0.0
          ]
        },
        "lensConfigId": "probe-3b3ffff8d986",
        "modelVersion": "bert-base-chinese@1ced0d0618636074b136d907a79e95e99f657b64 + hfl/chinese-roberta-wwm-ext@c7f6dbf801a0243a6e5bd126fb9c4a8f9ae7a4e2#agg-v1",
        "probeSetHash": "3b3ffff8d9865936663059b824be13352af0ba9007322b8d6257eb31d91d8247",
        "stability": 1.0,
        "crossModelAgreement": 0.97619047619,
        "caseStrength": 0.465352571424
      },
      "scoring": {
        "cap": 4,
        "bCumulative": 0.7,
        "maxTargets": 3
      },
      "explain": {
        "copyId": "EXP-L1-01",
        "text": "五处奶娃是同一个人，AI 会多次回看奶娃。"
      },
      "humanRationale": "五个奶娃明确同指，用于技术验收重复目标合并。",
      "provenance": {
        "source": "ai-assisted",
        "pipelineVersion": "board-b-v1"
      },
      "review": {
        "status": "draft",
        "notes": "受控重复技术样例，仅用于门禁与集成测试，待内容负责人审核。"
      }
    },
    {
      "schemaVersion": "1.0.0",
      "id": "L1-02",
      "level": 1,
      "template": "coref-repeat",
      "tokens": [
        "小胖",
        "收书",
        "，",
        "小胖",
        "找笔",
        "，",
        "小胖",
        "，",
        "小胖",
        "，",
        "小胖",
        "笑",
        "了",
        "。"
      ],
      "focus": 11,
      "punct": [
        2,
        5,
        7,
        9,
        13
      ],
      "coref": [
        {
          "entity": "小胖",
          "members": [
            0,
            3,
            6,
            8,
            10
          ],
          "refersFrom": []
        }
      ],
      "causal": [],
      "attention": {
        "lenses": {
          "panorama": [
            0.034161694174093815,
            0.12889372730737253,
            0.0,
            0.029413601969064188,
            0.171370698880027,
            0.0,
            0.08274584352591406,
            0.0,
            0.1295721145796394,
            0.0,
            0.12685974466158167,
            0.0,
            0.29698257490230734,
            0.0
          ],
          "coref": [
            0.0668960791756225,
            0.16289082753870895,
            0.0,
            0.07381985736841767,
            0.16584952875907574,
            0.0,
            0.11847314150014643,
            0.0,
            0.11079099296874231,
            0.0,
            0.1922714270503388,
            0.0,
            0.10900814563894758,
            0.0
          ],
          "causal": [
            0.12076744822997491,
            0.08322644951284755,
            0.0,
            0.1205539195845719,
            0.152140176970327,
            0.0,
            0.1593786413128607,
            0.0,
            0.17199078762123454,
            0.0,
            0.1366272858661678,
            0.0,
            0.05531529090201563,
            0.0
          ],
          "emotion": [
            0.11329553678549367,
            0.15107904009577647,
            0.0,
            0.09022780722729255,
            0.23905961613595747,
            0.0,
            0.12086829382731736,
            0.0,
            0.13696289576041587,
            0.0,
            0.10605656171575274,
            0.0,
            0.04245024845199388,
            0.0
          ],
          "position": [
            0.015448972409603395,
            0.01635980920189009,
            0.0,
            0.01611276645643182,
            0.010379130932706123,
            0.0,
            0.011162978797429356,
            0.0,
            0.04366462043136006,
            0.0,
            0.8146198673534318,
            0.0,
            0.07225185441714728,
            0.0
          ]
        },
        "lensConfigId": "probe-3b3ffff8d986",
        "modelVersion": "bert-base-chinese@1ced0d0618636074b136d907a79e95e99f657b64 + hfl/chinese-roberta-wwm-ext@c7f6dbf801a0243a6e5bd126fb9c4a8f9ae7a4e2#agg-v1",
        "probeSetHash": "3b3ffff8d9865936663059b824be13352af0ba9007322b8d6257eb31d91d8247",
        "stability": 1.0,
        "crossModelAgreement": 0.833333333333,
        "caseStrength": 0.508523422918
      },
      "scoring": {
        "cap": 4,
        "bCumulative": 0.7,
        "maxTargets": 3
      },
      "explain": {
        "copyId": "EXP-L1-02",
        "text": "五处小胖是同一个人，重复出现会合并成一个目标。"
      },
      "humanRationale": "五个小胖同指，验证同指组在评分时只计一次。",
      "provenance": {
        "source": "ai-assisted",
        "pipelineVersion": "board-b-v1"
      },
      "review": {
        "status": "draft",
        "notes": "受控重复技术样例，仅用于门禁与集成测试，待内容负责人审核。"
      }
    },
    {
      "schemaVersion": "1.0.0",
      "id": "L2-01",
      "level": 2,
      "template": "coref-repeat",
      "tokens": [
        "豆包",
        "开机",
        "，",
        "豆包",
        "看图",
        "，",
        "豆包",
        "，",
        "豆包",
        "，",
        "豆包",
        "笑",
        "了",
        "。"
      ],
      "focus": 11,
      "punct": [
        2,
        5,
        7,
        9,
        13
      ],
      "coref": [
        {
          "entity": "豆包",
          "members": [
            0,
            3,
            6,
            8,
            10
          ],
          "refersFrom": []
        }
      ],
      "causal": [],
      "attention": {
        "lenses": {
          "panorama": [
            0.047921649841439755,
            0.19607425043829477,
            0.0,
            0.04970257547092085,
            0.18316560274597019,
            0.0,
            0.06642582688890893,
            0.0,
            0.08644621125183333,
            0.0,
            0.12704640418652893,
            0.0,
            0.24321747917610326,
            0.0
          ],
          "coref": [
            0.08527597682777907,
            0.15236293552014102,
            0.0,
            0.1333399532693731,
            0.17829608484559573,
            0.0,
            0.05477900417636376,
            0.0,
            0.05840323911404656,
            0.0,
            0.20258751656600857,
            0.0,
            0.13495528968069218,
            0.0
          ],
          "causal": [
            0.09903942174227903,
            0.11677429003862032,
            0.0,
            0.10009896893538685,
            0.21054206502109485,
            0.0,
            0.1387686626748331,
            0.0,
            0.14476785355471,
            0.0,
            0.1373429720262521,
            0.0,
            0.052665766006823767,
            0.0
          ],
          "emotion": [
            0.11725635176852062,
            0.13672746298939667,
            0.0,
            0.09295650810845156,
            0.2541487582522548,
            0.0,
            0.11461716961866486,
            0.0,
            0.12814111318683502,
            0.0,
            0.1230137041796512,
            0.0,
            0.033138931896225264,
            0.0
          ],
          "position": [
            0.020822889238781856,
            0.009354291899111364,
            0.0,
            0.01632416373915841,
            0.015465794901367059,
            0.0,
            0.013280116583069351,
            0.0,
            0.0427780201464096,
            0.0,